,product_title,product_price,product_img_url,product_rating,product_rating_count
0,Wrangler Authentics Men's Classic 5-Pocket Cotton Relaxed Fit Jean,$34.22,https://m.media-amazon.com/images/I/71Kr2SwizZL._AC_UL400_.jpg,4.5,"78,798"
1,Lucky Brand Men's 410 Athletic Fit Jean,$47.99,https://m.media-amazon.com/images/I/81zZgTFVkYL._AC_UL400_.jpg,4.5,"3,587"
2,Alleson Ahtletic Kids' Youth Pull on Baseball Pant,$14.40,https://m.media-amazon.com/images/I/610Cb1E8MhL._AC_UL400_.jpg,4.4,344
3,Levi's Men's 550 Relaxed Fit Jeans,$48.65,https://m.media-amazon.com/images/I/510KcDrnDdL._AC_UL400_.jpg,4.5,"72,482"
4,Wrangler Men's Relaxed Fit Boot Cut Jean,$33.95,https://m.media-amazon.com/images/I/71qxXvfh7TL._AC_UL400_.jpg,4.6,"49,457"
5,2LUV Women's Trendy Skinny 5 Pocket Stretch Uniform Pants,$28.59,https://m.media-amazon.com/images/I/51gfLOcBN0L._AC_UL400_.jpg,4.1,"4,362"
6,The Children's Place Single and Toddler Boys Basic Bootcut Jeans,N/A,https://m.media-amazon.com/images/I/91Z+P4kErsL._AC_UL400_.jpg,4.8,"13,071"
7,Levi's Men's 502 Taper Fit Jeans (Regular and Big & Tall),$55.65,https://m.media-amazon.com/images/I/51jsYOc1fcL._AC_UL400_.jpg,4.5,"10,504"
8,Alleson Athletic Teen-Boys Youth Baseball Pant with Braid,$25.00,https://m.media-amazon.com/images/I/41bMXQP0geL._AC_UL400_.jpg,4.0,7
9,Lucky Brand Men's 221 Straight Jean,$99.00,https://m.media-amazon.com/images/I/51oXgolr4mL._AC_UL400_.jpg,4.5,"2,795"
10,Alleson Ahtletic Boys' Youth Elastic Bottom Baseball Pant,$21.94,https://m.media-amazon.com/images/I/61gnhAFgf1L._AC_UL400_.jpg,4.1,481
11,Lee Women's Petite Relaxed Fit Straight Leg Jean,$39.99,https://m.media-amazon.com/images/I/81D-CpHYGCS._AC_UL400_.jpg,4.1,"5,314"
12,WallFlower Women's Luscious Curvy Bootcut Mid-Rise Insta Stretch Juniors Jeans (Standard and Plus),N/A,https://m.media-amazon.com/images/I/61WlkW5qZsL._AC_UL400_.jpg,4.4,"46,867"
13,Rosie Pope Baby baby-boys Rosie Pope Baby Boys Pants & Jeans (Many Options Available!),$39.10,https://m.media-amazon.com/images/I/716DPF9nxRL._AC_UL400_.jpg,N/A,N/A
14,Lee Men's Extreme Motion Straight Fit Tapered Leg Jean,$34.90,https://m.media-amazon.com/images/I/817qC6rtrHS._AC_UL400_.jpg,4.6,"27,437"
15,The Children's Place Boys Baby and Toddler Pull on Straight Jeans,$15.09,https://m.media-amazon.com/images/I/91iyGaWZNbL._AC_UL400_.jpg,4.7,"22,176"
16,JANTTAWEAR New Regular Straight Men Jeans Denim Ripped Elastic Jeans.,$25.99,https://m.media-amazon.com/images/I/51ktyiGfJ9L._AC_UL400_.jpg,4.5,6
17,Levi's Women's Premium Ribcage Straight Ankle Jeans,$98.00,https://m.media-amazon.com/images/I/71UYjbXW6WL._AC_UL400_.jpg,4.2,771
18,Alleson Athletic Youth Baseball Pant with Braid,$27.00,https://m.media-amazon.com/images/I/41HlmMikV+L._AC_UL400_.jpg,4.5,4
19,Levi's Men's 505 Regular Fit Jeans,$48.65,https://m.media-amazon.com/images/I/61NlrvixWeL._AC_UL400_.jpg,4.5,"112,568"
20,Rosie Pope Baby Boys Denim Jeans,$19.31,https://m.media-amazon.com/images/I/619m86KV9+L._AC_UL400_.jpg,3.8,13
21,FALABELLA Men's Signature Stretch Skinny-fit Jeans - Denim Pants Essential Clothing W One Button Clossing Style,$38.00,https://m.media-amazon.com/images/I/61Qrc0nKQeL._AC_UL400_.jpg,4.4,22
22,Kenneth Cole Mens Jeans Slim Fit and Athletic Fit - Mens Stretch Jeans - 5-Pocket Jeans for Men,$89.99,https://m.media-amazon.com/images/I/7114TdLnlqL._AC_UL400_.jpg,4.4,91
23,HUNGSON Men Skinny Slim Fit Casual Jeans Dyeing Stretch Straight Fashion Denim Pants,$35.99,https://m.media-amazon.com/images/I/51fvCH1BauL._AC_UL400_.jpg,4.2,116
24,AITITIA Men's Ripped Regular Fit Jeans,$32.98,https://m.media-amazon.com/images/I/71fzH48xuHL._AC_UL400_.jpg,4.2,"3,291"
25,Levi's Women's 311 Shaping Skinny Jeans (Standard and Plus),$48.65,https://m.media-amazon.com/images/I/515mbjhBbMS._AC_UL400_.jpg,4.5,"13,327"
26,Jessica Simpson Womens Sawyer Heathered Flutter Sleeve Graphic T-Shirt,$36.63,https://m.media-amazon.com/images/I/81MejXTSDdL._AC_UL400_.jpg,4.3,20
27,Amazon Essentials Men's Skinny-Fit Stretch Jean,$28.80,https://m.media-amazon.com/images/I/71AYGjz9XeL._AC_UL400_.jpg,4.3,"12,366"
28,Levi's Women's Premium Wedgie Icon Fit Jeans,$89.50,https://m.media-amazon.com/images/I/61ZpEf7331L._AC_UL400_.jpg,3.9,"1,144"
29,QBK 2T/3T/4T/5T Toddler Baseball Pants Youth Softball Pants Kids Tee Ball Pants for Boy Girl,$28.99,https://m.media-amazon.com/images/I/61Se+lCk5TL._AC_UL400_.jpg,4.7,292
30,"BULLIANT Men's Belt, Brand Ratchet Belt Of Genuine Leather For Men Dress,Size Customized",$17.99,https://m.media-amazon.com/images/I/81Z7xUWx3RL._AC_UL400_.jpg,4.7,"5,539"
31,Evolution Men's Washed Stretch Slim Fit Jeans Zipper Closure Cotton 12 oz Denim,$39.99,https://m.media-amazon.com/images/I/81eiGKXEOiL._AC_UL400_.jpg,3.5,7
32,DANT BULUN Men's Ripped Distressed Destroyed Slim Fit Straight Leg Denim Jeans,$34.99,https://m.media-amazon.com/images/I/81YV6ilhbNL._AC_UL400_.jpg,4.0,"5,656"
33,Levi's Men's 541 Athletic Fit Jeans,N/A,https://m.media-amazon.com/images/I/61AnFoM7xNL._AC_UL400_.jpg,4.6,"26,469"
34,Jessica Simpson Women's Carly Flutter Short Sleeve Tee Shirt,$17.22,https://m.media-amazon.com/images/I/91PGLDEAHIL._AC_UL400_.jpg,3.6,51
35,Democracy Women's Ab Solution Straight Leg Jean,$42.60,https://m.media-amazon.com/images/I/71wGK+IuKZL._AC_UL400_.jpg,4.3,"6,594"
36,Levi's Men's 569 Loose Straight Fit Jeans,$48.65,https://m.media-amazon.com/images/I/81jiVGVXS2L._AC_UL400_.jpg,4.6,"34,472"
37,QBK 2T-13Years Girls' Softball Pants Kids' Youth Boys' Baseball Practice Pant Toddler tee Ball Pants,$28.99,https://m.media-amazon.com/images/I/51DHmuZmCQL._AC_UL400_.jpg,4.1,37
38,QBK 2T/3T/4T/5T/6T/7T Toddler Boy's Knicker Baseball Pants with Side Piping/Braid,$28.99,https://m.media-amazon.com/images/I/51cqPJMUO9L._AC_UL400_.jpg,4.3,24
39,Silver Jeans Co. Men's Craig Classic Fit Bootcut Jeans,$75.56,https://m.media-amazon.com/images/I/71OqBWC53eL._AC_UL400_.jpg,4.5,"2,171"
40,SweatyRocks Women's Casual Button High Rise Skinny Denim Jeans,$44.99,https://m.media-amazon.com/images/I/71vLak1hwuL._AC_UL400_.jpg,3.9,973
41,Wrangler Authentics Men's Classic 5-Pocket Regular Fit Flex Jean,$32.08,https://m.media-amazon.com/images/I/81CGtpNkP7L._AC_UL400_.jpg,4.6,"52,374"
42,Levi's Women's Premium 501 Skinny Jeans,$57.98,https://m.media-amazon.com/images/I/51UDRMB49jL._AC_UL400_.jpg,3.9,"1,751"
43,Alleson Athletic Unisex-Teen Youth Pull on Baseball Pant,N/A,https://m.media-amazon.com/images/I/51gUnvlDPgL._AC_UL400_.jpg,4.5,394
44,Democracy Women's Petite Ab Solution Straight Leg Jean,$57.50,https://m.media-amazon.com/images/I/81bWuQhKxwL._AC_UL400_.jpg,4.3,"1,324"
45,Wrangler Men's Retro Slim Fit Straight Leg Jean,$52.23,https://m.media-amazon.com/images/I/714l4CY-y6L._AC_UL400_.jpg,4.4,"9,002"
46,Lee Men's Extreme Motion Athletic Fit Tapered Leg Jean,$39.85,https://m.media-amazon.com/images/I/51MmKHu1jAL._AC_UL400_.jpg,4.7,"10,713"
47,Lee Women's Instantly Slims Classic Relaxed Fit Monroe Straight Leg Jean,$32.90,https://m.media-amazon.com/images/I/61Y3Viur4mL._AC_UL400_.jpg,4.2,"13,214"
48,Lee Women's Relaxed-fit Side Elastic Tapered-leg Jean,$37.95,https://m.media-amazon.com/images/I/71zb4ajO0kL._AC_UL400_.jpg,3.9,"3,036"
49,Lee Women's Relaxed Fit Straight Leg Jean,$34.89,https://m.media-amazon.com/images/I/71eHyhjkmNL._AC_UL400_.jpg,4.3,"18,608"
50,Levi's Men's 501 Original Style Shrink-to-fit Jeans (Regular and Big & Tall),N/A,https://m.media-amazon.com/images/I/51JO5pSxNuL._AC_UL400_.jpg,4.4,"19,654"
51,SweatyRocks Women's Ripped Boyfriend Jeans Distressed Denim Ankle Length Jeans,$43.99,https://m.media-amazon.com/images/I/71B1s1BepjL._AC_UL400_.jpg,3.8,"3,334"
52,HUDSON Men's Blake Slim Straight Jean Rp,$205.00,https://m.media-amazon.com/images/I/717NfjEqH1L._AC_UL400_.jpg,4.1,39
53,NYDJ Women's Marilyn Straight Denim Jeans,$59.98,https://m.media-amazon.com/images/I/81ebrDwIJHL._AC_UL400_.jpg,4.2,"5,165"
54,Buffalo David Bitton Men's Relaxed Straight Driven Jeans,$71.99,https://m.media-amazon.com/images/I/81RCRFvYqyS._AC_UL400_.jpg,4.3,"2,431"
55,Mavi Men's Zach Regular Rise Straight Leg Jeans,$128.00,https://m.media-amazon.com/images/I/81vLXVcKBFL._AC_UL400_.jpg,4.6,101
56,Lucky Brand Men's 363 Vintage Straight Jean,$57.05,https://m.media-amazon.com/images/I/91zWSwGj8mL._AC_UL400_.jpg,4.4,"2,241"
57,Levi's Men's 550 '92 Relaxed Jean,$55.65,https://m.media-amazon.com/images/I/81y9Z0KPWRL._AC_UL400_.jpg,3.7,64
58,Wrangler Women's As Real As Wrangler Classic Fit Mid Rise Boot Cut Jean,$36.22,https://m.media-amazon.com/images/I/61oUrQ75ozL._AC_UL400_.jpg,4.1,967
59,Lee Men's Regular Fit Straight Leg Jean Pant,$44.02,https://m.media-amazon.com/images/I/91+XgDW8hYL._AC_UL400_.jpg,4.4,721
60,FALABELLA Men's Signature Stretch Skinny-fit Jeans - Denim Pants Essential Clothing W One Button Clossing Style,$38.00,https://m.media-amazon.com/images/I/71AePBzC2zL._AC_UL400_.jpg,4.4,22
61,AITITIA Men's Ripped Regular Fit Jeans,$33.98,https://m.media-amazon.com/images/I/61Jnxv4MSaL._AC_UL400_.jpg,4.2,"3,291"
62,Kenneth Cole Mens Jeans Slim Fit and Athletic Fit - Mens Stretch Jeans - 5-Pocket Jeans for Men,$91.99,https://m.media-amazon.com/images/I/51mtPTT4FgL._AC_UL400_.jpg,4.4,91
63,QBK 2T-13Years Girls' Softball Pants Kids' Youth Boys' Baseball Practice Pant Toddler tee Ball Pants,$28.99,https://m.media-amazon.com/images/I/51DHmuZmCQL._AC_UL400_.jpg,4.1,37
64,G-Star Raw Men's Revend Skinny Fit Jeans,$69.06,https://m.media-amazon.com/images/I/816WOMFsKML._AC_UL400_.jpg,4.4,"3,706"
65,Cinch Boys' White Label Regular Jeans,$41.03,https://m.media-amazon.com/images/I/61HZBfPqFiL._AC_UL400_.jpg,4.7,119
66,Levi's Boys' 510 Skinny Fit Performance Jeans,N/A,https://m.media-amazon.com/images/I/61hrAFwu-fL._AC_UL400_.jpg,4.7,"2,502"
67,Levi's® Vintage 1954 501 Tapered Jeans,$202.80,https://m.media-amazon.com/images/I/81Bn5G5LJEL._AC_UL400_.jpg,N/A,N/A
68,NYDJ Women's Petite Barbara Bootcut Jeans | Flare & Slimming Fit Pants,$99.00,https://m.media-amazon.com/images/I/41gRIm34VKL._AC_UL400_.jpg,3.8,322
69,Levi's Men's 501 '93 Straight Jeans,N/A,https://m.media-amazon.com/images/I/519JCUyzuIL._AC_UL400_.jpg,4.0,321
70,Lee Men's Regular Fit Straight Leg Jean,$36.90,https://m.media-amazon.com/images/I/71EmaA-ZHFL._AC_UL400_.jpg,4.5,"28,482"
71,Nautica Traditional Collection's Men's Relaxed Fit Jean Pant,$44.95,https://m.media-amazon.com/images/I/71Z1ef2qSbL._AC_UL400_.jpg,4.0,1
72,"IZOD Men's Classic Denim Jeans (Regular, Straight, and Relaxed Fit)",$59.50,https://m.media-amazon.com/images/I/71AKo80IKoL._AC_UL400_.jpg,4.2,269
73,Levi's 501 Original Fit Men's Jeans (Regular and Big & Tall),N/A,https://m.media-amazon.com/images/I/81G1Wrcx7UL._AC_UL400_.jpg,4.4,"8,439"
74,Levi's Men's 501 Original Fit Jeans,N/A,https://m.media-amazon.com/images/I/913fQp-qCNL._AC_UL400_.jpg,4.5,"82,811"
75,Levi's Men's 559 Relaxed Straight Jeans,N/A,https://m.media-amazon.com/images/I/5137bplE4kL._AC_UL400_.jpg,4.5,"47,887"
76,Baggy Wide Leg Jeans Non-Stretch Fabric High Waist Loose YKK Zipper for All Leg Types Suitable for All Kinds of People,$40.99,https://m.media-amazon.com/images/I/71QMet8BdeL._AC_UL400_.jpg,4.1,500
77,HUE Women's Original Jeans Capri Leggings,N/A,https://m.media-amazon.com/images/I/51clV71ZGWL._AC_UL400_.jpg,3.9,48
78,Levi's Men's Western Fit Cowboy Jeans (Regular and Big & Tall),$48.65,https://m.media-amazon.com/images/I/61CiCo3oFEL._AC_UL400_.jpg,4.4,"2,996"
79,Levi's Boys' 511 Slim Fit Performance Jeans,N/A,https://m.media-amazon.com/images/I/81aHWDFBHkL._AC_UL400_.jpg,4.7,"1,335"
80,HUNGSON Men Skinny Slim Fit Casual Jeans Dyeing Stretch Straight Fashion Denim Pants,$35.99,https://m.media-amazon.com/images/I/51fvCH1BauL._AC_UL400_.jpg,4.2,116
81,Astylish Womens High Waisted Baggy Jeans Boyfriend Cropped Denim Pants,$36.89,https://m.media-amazon.com/images/I/61nmDV0x+wL._AC_UL400_.jpg,3.9,38
82,QBK 2T/3T/4T/5T Toddler Baseball Pants Youth Softball Pants Kids Tee Ball Pants for Boy Girl,$26.99,https://m.media-amazon.com/images/I/41fzWWcHdwL._AC_UL400_.jpg,4.7,292
83,Levi's Women's 501 Original Fit Jeans,$55.65,https://m.media-amazon.com/images/I/51u5biWUQmL._AC_UL400_.jpg,4.0,162
84,Cinch Men's Black Label Loose Fit Jean,$60.45,https://m.media-amazon.com/images/I/71LVMltKjML._AC_UL400_.jpg,4.6,209
85,Levi's Boys' 511 Slim Fit Jeans,N/A,https://m.media-amazon.com/images/I/81sb1tU3LLL._AC_UL400_.jpg,4.7,"8,311"
86,Levi's Men's 517 Bootcut Jean,$48.65,https://m.media-amazon.com/images/I/81MUQDiyFLL._AC_UL400_.jpg,4.5,"22,084"
87,EnllerviiD Men's Jeans with Cargo Pockets Loose Comfort Hip Hop Denim Straight Relaxed Fit Multi Pockets Jeans,$43.99,https://m.media-amazon.com/images/I/71dmZPLMInL._AC_UL400_.jpg,4.2,73
88,QBK 2T/3T/4T/5T/6T/7T Toddler Boy's Knicker Baseball Pants with Side Piping/Braid,$27.99,https://m.media-amazon.com/images/I/51dUyqGw8rL._AC_UL400_.jpg,4.3,24
89,"Easton EC90 Case Unisex Adult, Black",$60.00,https://m.media-amazon.com/images/I/811JNU9sB0L._AC_UL400_.jpg,4.7,10
90,DANT BULUN Men's Ripped Distressed Destroyed Slim Fit Straight Leg Denim Jeans,$32.99,https://m.media-amazon.com/images/I/91z6WzsbjEL._AC_UL400_.jpg,4.0,"5,656"
91,Soojun Mens Elastic Waist Jeans Relaxed Fit with Zipper and Button,$32.99,https://m.media-amazon.com/images/I/61jN2VPW5cL._AC_UL400_.jpg,4.3,"1,231"
92,KUNMI Womens Curvy High Waist Stretch Butt Lifting Skinny Colombian Jeans,$36.99,https://m.media-amazon.com/images/I/61u9MUHEtpS._AC_UL400_.jpg,3.7,"3,861"
93,KUNMI Women's Ripped Boyfriend Slim Fit Jeans Frayed Distressed Stretchy Denim Pants,$36.99,https://m.media-amazon.com/images/I/615bZr5C0JL._AC_UL400_.jpg,3.9,"1,197"
94,EVALESS Ripped Jeans for Women Plaid Patch Boyfriend Skinny Distressed Denim Jean Pants,$42.98,https://m.media-amazon.com/images/I/71mD-JJ95lL._AC_UL400_.jpg,4.2,"1,529"
95,DANT BULUN Men's Ripped Slim Straight Fit Moto Biker Jeans with Zipper Deco,$38.99,https://m.media-amazon.com/images/I/8187oEJL5uL._AC_UL400_.jpg,4.4,"2,263"
96,Nudie Jeans Men's Lean Dean Jean in Dry Cold Black,$147.48,https://m.media-amazon.com/images/I/716uxTnszfS._AC_UL400_.jpg,4.6,49
97,Amazon Essentials Men's Skinny-Fit Comfort Stretch Jean (Previously Goodthreads),$38.90,https://m.media-amazon.com/images/I/81nwOUY7BML._AC_UL400_.jpg,4.3,"3,379"
98,Scotch & Soda Men's Regular-Fit Jean,$200.00,https://m.media-amazon.com/images/I/81j2fn9dx5L._AC_UL400_.jpg,4.5,88
99,HDLTE Women Ripped Boyfriends Jeans Distressed High Waist Baggy Denim Pants Wide Leg Straight Trousers Y2k Streetwear Pants…,$42.99,https://m.media-amazon.com/images/I/61U5oat3TcL._AC_UL400_.jpg,4.0,"1,679"
100,PajamaJeans Mens Jeans - Elastic Waist Pants Men,$62.99,https://m.media-amazon.com/images/I/71zuwlZZw+L._AC_UL400_.jpg,4.2,"3,106"
101,Resfeber Women's Ripped Boyfriend Jeans Cute Distressed Jeans Stretch Skinny Jeans with Hole,$42.99,https://m.media-amazon.com/images/I/61K5KPwwrBL._AC_UL400_.jpg,4.2,"25,529"
102,Signature by Levi Strauss & Co. Gold Label Men's Relaxed Fit Flex Jeans (Available in Big & Tall),N/A,https://m.media-amazon.com/images/I/519ekc2hUqL._AC_UL400_.jpg,4.5,"42,122"
103,KUNMI Women's Ripped Mid Waisted Boyfriend Jeans Loose Fit Distressed Stretchy Denim Pants,$36.99,https://m.media-amazon.com/images/I/712E50CTGfL._AC_UL400_.jpg,3.9,"1,687"
104,Amazon Essentials Men's Straight-Fit Stretch Jean,N/A,https://m.media-amazon.com/images/I/81A9YuWmDiL._AC_UL400_.jpg,4.3,"11,178"
105,Nudie Jeans Men's Tape Ted Slim Fit Jean In Black and Blue Love,$132.81,https://m.media-amazon.com/images/I/71+BfVTkwLL._AC_UL400_.jpg,N/A,N/A
106,Sidefeel Women Patchwork Destroyed Raw Hem Jeans Ripped Hole Denim Pants,$35.99,https://m.media-amazon.com/images/I/71vMliyL6hL._AC_UL400_.jpg,3.9,"4,929"
107,One Teaspoon Women's Scallywags Jeans,$144.75,https://m.media-amazon.com/images/I/41xP4z6ycgL._AC_UL400_.jpg,5.0,2
108,Amazon Essentials Men's Athletic-Fit Stretch Jean,N/A,https://m.media-amazon.com/images/I/91MZMCGta6S._AC_UL400_.jpg,4.3,"17,737"
109,YOYEAH Men's Regular Fit Jean Loose Relaxed Straight Leg Jeans,$59.99,https://m.media-amazon.com/images/I/61YCiC-HfIL._AC_UL400_.jpg,4.1,150
110,Amazon Essentials Men's Slim-Fit Stretch Jean,$28.44,https://m.media-amazon.com/images/I/81x9J2yotGL._AC_UL400_.jpg,4.3,"30,422"
111,IZOD Men's Jeans - Comfort Stretch Denim Straight Leg Relaxed Fit Jeans for Men,$29.99,https://m.media-amazon.com/images/I/51LBKhCP0+L._AC_UL400_.jpg,4.2,129
112,Wrangler Boys' 20x Extreme Relaxed Straight Jean,$24.97,https://m.media-amazon.com/images/I/91OT7P7ptwL._AC_UL400_.jpg,4.4,106
113,"CQR Men's Ripstop Work Pants, Water Resistant Tactical Pants, Outdoor Utility Operator EDC Straight/Cargo Pants",$59.99,https://m.media-amazon.com/images/I/613dCFvkUJL._AC_UL400_.jpg,4.4,"5,360"
114,Sidefeel Women Ripped Flare Jeans Mid Rise Fitted Denim Pants,$37.99,https://m.media-amazon.com/images/I/61A+weYSr1L._AC_UL400_.jpg,3.8,"5,948"
115,roswear Womens High Waisted Skinny Stretch Butt Lifting Jeans,$37.99,https://m.media-amazon.com/images/I/71NmA84ODwL._AC_UL400_.jpg,3.8,"2,491"
116,Lee Little Boys' Contractor Jeans,$19.33,https://m.media-amazon.com/images/I/51m-AU91wcL._AC_UL400_.jpg,3.6,18
117,Noppies Women's Maternity Jeans OTB Reg Ann,$129.99,https://m.media-amazon.com/images/I/81Isl0RIydL._AC_UL400_.jpg,2.5,3
118,JANTTAWEAR New Regular Straight Men Jeans Denim Ripped Elastic Jeans.,$25.99,https://m.media-amazon.com/images/I/51ktyiGfJ9L._AC_UL400_.jpg,4.5,6
119,YOYEAH Men's Fashion Big Loose Relaxed Straight-Leg Jeans,$61.99,https://m.media-amazon.com/images/I/61YCiC-HfIL._AC_UL400_.jpg,4.1,319
120,FALABELLA Men's Signature Stretch Skinny-fit Jeans - Denim Pants Essential Clothing W One Button Clossing Style,$38.00,https://m.media-amazon.com/images/I/71JO-s+LevL._AC_UL400_.jpg,4.4,22
121,AITITIA Men's Ripped Regular Fit Jeans,$32.98,https://m.media-amazon.com/images/I/714G0v4-aQL._AC_UL400_.jpg,4.2,"3,291"
122,OFLUCK Women Stretch Ripped High Waisted Jeans Frayed Raw Hem Distressed Denim Pants with Hole,$39.99,https://m.media-amazon.com/images/I/71+aRxIph+S._AC_UL400_.jpg,4.1,"1,088"
123,QBK 2T/3T/4T/5T Toddler Baseball Pants Youth Softball Pants Kids Tee Ball Pants for Boy Girl,$29.99,https://m.media-amazon.com/images/I/61Se+lCk5TL._AC_UL400_.jpg,4.7,292
124,Noppies Women's Maternity Jeans OTB Slim Gunn,$135.09,https://m.media-amazon.com/images/I/61iRDpLK-VL._AC_UL400_.jpg,N/A,N/A
125,"[blanknyc] Men's In The Face Slim Fit Jeans, charcoal, 34",$44.06,https://m.media-amazon.com/images/I/81jglBrdG4S._AC_UL400_.jpg,N/A,N/A
126,Men's Skinny Jeans Stretch Ripped Tapered Leg,$33.99,https://m.media-amazon.com/images/I/51d86Ji4uJL._AC_UL400_.jpg,4.4,"4,698"
127,Noppies Women's Maternity Jeans OTB Skinny Avi,$107.78,https://m.media-amazon.com/images/I/61gGy3XhhdL._AC_UL400_.jpg,N/A,N/A
128,Noppies Women's Maternity Jeans OTB Slim Leah,$107.44,https://m.media-amazon.com/images/I/71z+y56f+8L._AC_UL400_.jpg,3.0,6
129,Smith's Workwear Men's Stretch Relaxed Fit Carpenter Jean,$23.99,https://m.media-amazon.com/images/I/91zLkOm2XjL._AC_UL400_.jpg,4.3,267
130,Maternal America Women's Skinny Maternity Jeans,$26.60,https://m.media-amazon.com/images/I/81wpHK26vqL._AC_UL400_.jpg,2.9,8
131,Maternal America Women's Skinny Ankle Maternity Jeans,$59.14,https://m.media-amazon.com/images/I/81lInDHqTsL._AC_UL400_.jpg,2.9,31
132,Hybrid Women's Butt Lift Super Comfy Stretch Denim Skinny Yoga Jeans,$30.99,https://m.media-amazon.com/images/I/71lMhtxN8DL._AC_UL400_.jpg,4.1,"11,406"
133,GINGTTO Mens Skinny Jeans Stretch Denim Stylish Jeans for Men,$31.99,https://m.media-amazon.com/images/I/61uqbB9-vCL._AC_UL400_.jpg,4.4,930
134,WULFUL Men's Slim Fit Skinny Stretch Comfy Denim Jeans Pants,$29.99,https://m.media-amazon.com/images/I/61bMI38WAwL._AC_UL400_.jpg,4.3,"6,334"
135,QBK 2T-13Years Girls' Softball Pants Kids' Youth Boys' Baseball Practice Pant Toddler tee Ball Pants,$29.99,https://m.media-amazon.com/images/I/51d6viweTfL._AC_UL400_.jpg,4.1,37
136,QBK 2T/3T/4T/5T/6T/7T Toddler Boy's Knicker Baseball Pants with Side Piping/Braid,$27.99,https://m.media-amazon.com/images/I/510xjGAm4RL._AC_UL400_.jpg,4.3,24
137,HUNGSON Men Skinny Slim Fit Casual Jeans Dyeing Stretch Straight Fashion Denim Pants,$35.99,https://m.media-amazon.com/images/I/51jlWkmkhwL._AC_UL400_.jpg,4.2,116
138,Izod Men's Comfort Stretch Denim Jeans,$48.61,https://m.media-amazon.com/images/I/81kqGAvuEXL._AC_UL400_.jpg,4.5,"5,077"
139,IZOD Men's Jeans - Comfort Stretch Denim Straight Leg Relaxed Fit Jeans for Men,$23.00,https://m.media-amazon.com/images/I/71a6kJqHYEL._AC_UL400_.jpg,4.3,480
140,Baseball USA Flag American Flag Vintage T-Shirt,$22.95,https://m.media-amazon.com/images/I/71xvxQwUE4L._AC_UL400_.jpg,4.5,24
141,Kenneth Cole Mens Jeans Slim Fit and Athletic Fit - Mens Stretch Jeans - 5-Pocket Jeans for Men,$89.99,https://m.media-amazon.com/images/I/61dkpd0TQSL._AC_UL400_.jpg,4.4,91
142,DANT BULUN Men's Ripped Distressed Destroyed Slim Fit Straight Leg Denim Jeans,$32.99,https://m.media-amazon.com/images/I/91z6WzsbjEL._AC_UL400_.jpg,4.0,"5,656"
